614372,"1","Firefox will not allow me access to Sky Calendar from my Sky.com eMail page",1268437325,\N
614374,"1","I just downloaded 3.6 upgrade on a windows xp OS and as soon as I opened up firefox after the upgrade, everything was tiny.  I went into the support and did the about:config.  This put all my toolbars back to the normal size, but now the web pages are too",1268437605,\N
614375,"1","Firefox loses all data from the text boxes when i click \"submit\"",1268437632,\N
614377,"1","Everytime I select a link on my blog to a document also on my blog, the document both auto-downloads to my downloads Folder and Opens in another window on my blog. This procedure doesn't download the doc in Safari, so how can I have the doc only Open, not",1268437740,\N
614379,"1","how can I increase the sound",1268437770,\N
614381,"1","When trying to install Flash, fails: Can't establish SSL connection (16263.331. ... but setup passes Boston University SSL test (on Windows XP, Toshiba Satellite Pro laptop, latest Firefox just installed). Thanks.",1268437888,\N
614382,"1","Firefox doesn't allow to type in certain dialogue boxes",1268437966,\N
614383,"1","when I try to bookmark a site, the complete list of folders doesn't show",1268437981,1268438105
614384,"1","automatically detect settings checks, but can't click ok to set it",1268438015,\N
614390,"1","How do i go from one e-mail yo another without \"quit\" of \"stay and quit\" I keep going back to welcome screen and then have to go to home page and back to e-mail",1268438291,\N
614394,"1","Locking Down Firefox: How do I remove the 'History' icon in the left pane of 'Organize Bookmarks/Library' window?",1268438650,1268484038
614395,"1","After updating Firefox, links clicked in Windows Live Messenger won't automatically open anymore",1268438662,\N
614397,"1","I am having choppy audio/video playing of my favorite church broadcasts (mainly joycemeyer.org and intouch.org)  A few weeks ago, I made some adjustments to the \"actions\"  to my \"applications\" in the tools options.  Maybe it caused my listening/watching t",1268438746,\N
614398,"1","can't load www.garmin.com",1268438803,1268481222
614402,"1","I am having choppy audio/video playing of my favorite church broadcasts (mainly joycemeyer.org and intouch.org)  A few weeks ago, I made some adjustments to the \"actions\"  to my \"applications\" in the tools options.  Maybe it caused my listening/watching t",1268438958,\N
614404,"1","What firefox version works with google and also the Zynga toolbar and I am having trouble with Netflix ?",1268439110,\N
614405,"1","I cannot download Firefox 3.6.  I've tried erasing the download file.  I cannot get beyond logging out of Firefox.",1268439137,\N
614406,"1","personas have messed up my yahoo page",1268439148,\N
614407,"1","i cant get firefox out of safe mode",1268439151,1268480358
614409,"1","searches suddenly dont work - last night a facebook search gave me the person this eve it doesnt and when I search a street on aa.com it doesnt come up with its normal list of street options what's wrong??",1268439348,\N
614413,"1","I AM BLIND HOW CAN I SET THE SCREEN TO FIT MT SCREEN WHRB I START FIRFOX",1268439418,\N
614414,"1","I downloaded Personas Plus and now Firefox windows do not appear at all",1268439438,\N
614417,"1","My mouse scroll still doesn't work in FireFox 3.6, but it works fine in IE, and FF 3.5, I've tried the troubleshooting page and nothing so far has worked.  Any suggestions?",1268439541,\N
614420,"1","I can search on eBay, but when I click on a specific item the description does not load",1268439697,\N
614422,"1","Navigating web pages is normal, but within email messages, I cannot scroll using my mouse.",1268439771,\N
614423,"1","I want I want 3.5.6 back and not this 3.6. And something will not let me get it back",1268439779,1268440488
614424,"1","I connect to the web through a proxy and since upgrading to 3.6 i get asked for a username and password for every single page i navigate to. Before if I entered my password once it was enough for my entire session. How can I fix this?",1268439796,1268441845
614425,"1","Can I use Netflix and facebook games withFirefox3.6",1268439819,1268440045
614428,"1","Firefox hangs when I'm clicking on some links",1268439903,\N
614432,"1","How do I get pictures (img) to print when printing a webpage?",1268439963,\N
614434,"1","I am trying to download the lates version of the Adobe Flash Player.  Instructions say to look for a box that says edit options.  I cannot find that box.Please help me, if possible.",1268440120,1268480256
614438,"1","Recently updated Firefox and now I can't delete any of my msn or live mail.",1268440391,\N
614440,"1","I upgraded to Firefox 3.5.8....I no longer have my bookmarks..how do I retirieve them?",1268440407,\N
614442,"1","I downloaded Firefox 3.6 and now I can not use it.  My home page is yahoo and when I get there, I can not go anywhere else.  I have used Internet explorer and everything works great.  How do I switch back on Firefox?",1268440469,1268835919
614444,"1","firefox dosent work",1268440538,\N
614445,"1","How do I make my Home Page bigger so that it fills my computer screen?",1268440589,\N
614446,"1","opening an email with windows viewer instead of saving it to a folder",1268440694,\N
614447,"1","when filling out a multi-page form, the first page appears (ghostly) over the second page and I can't complete the second page. How can I prevent this?",1268440707,1268542315
614448,"1","Mouse scroll wheel still inactive in Firefox 3.6 while reading Yahoo mail",1268440886,1268841337
614449,"1","unlock the block on volume on Webster dictionary",1268440912,\N
614450,"1","middle mouse button has lost functionality / can't vertical scroll",1268440949,1268442904
614453,"1","How do i restore the \"autocomplete\" \"awesome\" option? Since Downloading the latest firefox upgrade, it doesnt  work from 'privacy' tab in 'options'",1268441009,1268477854
614455,"1","When I page zoom, how do I make every page like that? So I don't have to do it every time I go to a new page?",1268441209,1268464551
614456,"1","Firefox is very slow in Facebook and the games can not be seen completely.  Always locks up in Facebook.",1268441221,\N
614457,"1","downloading 3.6 version i get the error message code overrun .How do I correct this?",1268441227,\N
614458,"1","i suppressed my address bar and google toolbar how do I get them back",1268441260,1268464508
614459,"1","how to change photo in top menu bar",1268441298,1268477717
614462,"1","Firefox crahses unexpectedly / leaves no dump file, after a long time with a radio stream running",1268441632,1268875450
614464,"1","Firefox 3.6 won't log into proxy and repeatedly asks for login",1268441768,\N
614467,"1","when i go on some websites the page loads then turns white with nothing on it",1268442059,\N
614468,"1","After updating Firefox and Windows XP, Firefox will not open.  I get a message that say firefox.exe. bad image; The application or DLL C\\Program files\\Mozilla Firefox\\sqlite3.dll is not a valid Windows image. Please check this against your installation di",1268442105,\N
614469,"1","I can type material into the address bar, but Firefox 3.6 does not respond when I hit \"enter\" or try to click on something like a \"go\" button.",1268442149,1268442334
614472,"1","My menus don't show any more.  How do I restore them?",1268442224,1268464409
614473,"1","latest Firefox update and now Tabs are blurred except one being used.",1268442277,1268477586
614476,"1","Hate the new version was able to control reloading now I cant and other things SUCK with the new version",1268442519,\N
614482,"1","How can I download a Quicktime mp3 in Firefox?",1268442710,\N
614483,"1","my web page will play sound in IE but not foxfire",1268442808,\N
614484,"1","Firefox crashes on Farmville constantly. Every time I'm on there for more than about 5 minutes, it starts freezing up, and eventually freezes my entire computer!",1268442855,1268692610
614486,"1","How do I remove the \"ask toolbar\"?",1268442937,\N
614487,"1","downloaded new firefox version. Cannot see videos on youtube.",1268442999,1268464219
614488,"1","I want to disable history-clearing and private browsing (for use in a work environment).",1268443078,1268625950
614491,"1","since upgrading to firefox 3.6 things have been sluggist about moving from one site to another.  Some screens freeze.",1268443312,\N
614492,"1","Cursor does not appear when replying to email in yahoo mail",1268443393,1268775826
614494,"3","Redesigning the Firefox support forums",1268443536,\N
614497,"1","Get  \"not a valid win32 app\" when downloading firfox 3.6",1268443845,1268477567
614498,"1","firefox is already running",1268443928,\N
614499,"1","my home page is yahoo and i have firefox and printer willnot work",1268443935,1268464136
614500,"1","After upgrading to FF3.6, the downloading videos with Realplayer doesn't work anymore. This seems to happen with every upgrade without warning. If warned I wouldn't have done the upgrade. Please advise or have the problem fixed. Thanks.",1268444112,1268464106
614501,"1","Whenever I type in \"youtube\" or such, the awesome bar does not direct it to youtube.com, but to a Comcast page saying an error has occured",1268444117,1268477487
614502,"1","Page zoom resets when when the page is refreshed.",1268444205,1268477427
614503,"1","Firefox taking me to different website",1268444225,\N
614506,"1","Newest version of Firefox downloaded and is all messed up.",1268444328,\N
614507,"1","My internet explorer is getting old.  Should I update it to latest version?  Should I expect problems if I do?  I don't use it.",1268444520,\N
614510,"1","I been using the KeepVid downloader for a while when downloading from you tube and saving the files  but now whenever  i try to download i get this message -    Firefox can't find the file at http://v15.lscache5.c.youtube.com/videoplayback?ip=0.0.0.0&spar",1268444799,\N
614512,"1","Adobe.com loads, but no content is visable except for the background color. Opera is the only browser that displays content.",1268444825,1268530507
614514,"1","Why can't I use the scroll dial on my mouse in Firefox since installing the latest update?",1268444998,\N
614520,"1","Upgraded to 3.6; now Text Tist online doesn't load.",1268445478,\N
614522,"1","Don't like URL Menu bar settings.",1268445715,\N
614523,"1","My hyperlinks are displaying as they should",1268445893,\N
614524,"1","Firefox audio not heard through laptop speakers (works in headphones) while video plays, but with other browsers (IE, Chrome, Safari) the sound is heard.",1268446002,\N
614529,"1","firefox is not prompting user names and passwords since the last upgrade",1268446272,\N
614531,"1","Why cant I view a website after i updated to 3.6",1268446563,\N
614536,"1","how do i downgrade back to ff 3.5 for java 1.5 support.",1268446829,\N
614541,"1","i have the menu hidden. how do i get it back?",1268447277,1268463328
614543,"1","I have updated and then downgraded so that I could continue to use my Neopets toolbar, but I can't find the correct version. Does anyone know what version will work with the Neopets Toolbar?",1268447424,\N
614544,"1","I just installed Ffx on my Win7 machine and the websites don't come up in a large format.  Is there a glitch with the program?",1268447438,\N
614548,"1","Add-on settings cached somewhere?",1268447539,1268452676
614549,"1","How do I delete the trash ?",1268447618,1268463292
614550,"1","Problem with Portuguese language after 3.6 version",1268447674,\N
614553,"1","after recent FF update I can't access Yahoo games. I get a Java error message. How do I fix this?",1268447977,1268463232
614554,"1","unable to restore bookmarks from jsom or html files--'unable to process the backup file' message",1268448010,\N
614557,"1","Facebook is not working correctly on Firefox",1268448254,\N
614562,"1","firefox defaulting to older version, how can I upgrade without deleting old version?",1268448381,1268461516
614563,"1","Firefox consistently fills a search field on help pages with an old request.  I've triend using the custom setting and disabling remember form history and clearing the form history but the value still appears.  If I swtich to private mode the problem disa",1268448491,1268448846
614566,"1","Personas are all too big for the menu section of the broswer and they're stretched. How can I ajdust the size so I can see the image?",1268448631,1268483974
614567,"1","Firefox locks up my comp, then have to power it off then comp tells me C drive  is dirty. Just started happening so I can't use it anymore",1268448813,\N
614568,"1","when I click \"show all history\" all I get is a window that shows no history,how can I get my browsing history back?",1268448840,\N
614572,"1","how can i fix my problem  -- low level of sound during blitz chessgame on gameknot.com",1268449021,\N
614574,"1","how do I get firefox to allow my hp photo essentials to run?",1268449606,\N
614578,"1","why doesn't the original message snow up when responding to an e-mail with hotmail?",1268449954,\N
614580,"1","Firefox won't start after update.",1268450094,1268479775
614581,"1","how do i get rid of version 3.6 which sux and go back to the previous version?",1268450149,1268454014
614582,"1","Tab icons are not showing up after I close and restart Firefox",1268450158,\N
614586,"1","After installing Norton Security Suite, Firefox no longer saves cookies.",1268450464,1268785863
614602,"1","Fonts much less clear than Internet Explorer -  IE fonts seem bolder, sharper, easier to read",1268451489,1268531660
614606,"1","How do I get my tabs to open at the end, not next to the current tab?",1268452367,1268460990
614608,"1","When Firefox is running, and minimized in the dock, when I click on a link in an e-mail, Firefox doesn't maximize itself to the desktop",1268452498,\N
614610,"1","I can't find the toolbar to make changes on facebook.  Firefox is blocking my pictures.",1268452745,1268488754
614611,"1","Can I import Bookmarks from Firefox 2.0.0.20 to Firefox 3.6 ?",1268452746,1268535071
614614,"1","After installing Firefox 3.6 mouse whell stopped working. It doesn't work in any website I navigate. Solution given for general mouse scroll problem doesn't work either.",1268453353,\N
614615,"1","How can I make the scrolling back to what it was like in version 3.5?",1268453428,1268602547
614616,"1","How can I make the images and print on web pages larger?",1268453898,\N
614617,"1","What can I do to improve video quality?",1268453971,\N
614619,"1","Latest version of Firefox (3.6) download will now no longer startup",1268454063,\N
614621,"1","How do I get rid of the new download. Do not like format.",1268454223,\N
614622,"1","My Firefox hangs every time I open a page with a java applet.  I have installed the newest version and checked my pluggin but it still isn't working.  I went to the Java site and it is saying I have the recomended version, but when I go to test my java vi",1268454289,\N
614623,"1","I keep losing the bottom status bar, where seo quake button resides. View status is checked. Help?",1268454369,\N
614625,"1","will thunderbird 3 work with 64 bit windows 7?",1268454443,\N
614626,"1","Some folders missing after importing IE bookmarks",1268454446,1268552967
614630,"1","Downloaded 3.6 last night and has webpage has froze every 10 minutes I'm online",1268454652,\N
614631,"1","Firefox will not download, despite my laptop meeting system requirements.",1268454662,1268460661
614632,"1","I updated to 3.6, chose a personal \"theme\" pic.  Now I can't view many  photos on web. I want the graphis around url box OFF.  How do I do this?",1268454689,1268488786
614633,"1","Now that I've upgraded to Firefox 3.6 the ebay thumbnails load VERY slowly and some do not load at all",1268454712,1268523833
614634,"1","Firefox does not display pictures on eBay",1268454741,1268484825
614635,"1","how do I upload a 20 mb pdf file as an email attachment?",1268454829,1268456488
614636,"1","If I can't get newly updated Firefox to start, how am I supposed to use the profile manager to fix it, as indicated in help questions?",1268455103,\N
614637,"1","I installed Kiwee stuff, but got rid of it. But now, whenever I type in the URL box to search something, it goes to kiwee search. How do I go back to how it was before?? (before=typed something in, like, just 'youtube', and it'd automatically go to the si",1268455113,\N
614638,"1","Web links not working",1268455160,\N
614639,"1","Previous Tabbs Don't Save Upon Restart.",1268455212,1268458088
614643,"1","unable to open pdf file from gmail in different tab",1268455668,\N
614645,"1","Why can others see my email with your browser?",1268455688,\N
614646,"1","Why did my button backgrounds turned solid grey?",1268455759,\N
614652,"1","When I try to start Firefox or Firefox (Safe Mode) a dialogue box pops up and tells me that \"The application or DLL C:\\Program Files\\Mozilla Firefox\\xul.dll is not a valid Windows image. Please check this against your installation diskette,\" and the only ",1268456205,1268531576
614654,"1","Autocomplete resets everytime I close Ff 3.6",1268456267,\N
614662,"1","under \"organize bookmarks\" the folder \"unsorted bookmarks\" does not display the unsorted bookmarks in the bookmarks menu.",1268456698,\N
614663,"1","Why can't I see my plugins, add-ons/extensions, themes, languagesm, etc anymore?  I click on the tools-addons menu and all installed stuff are no longer there but are still enabled in my browser.",1268456740,\N
614665,"1","Missing IE icon in tray",1268456868,\N
614667,"1","Before downloading 3.6, pdf files would open automatically in Preview on my Mac. I've gone to preferences and told Firefox to open pdfs in preview, in this latest version, but when trying to open pdfs from the web, I get a popup box asking where I want to",1268456992,\N
614668,"1","When composing emails and google does an auto-save, the font setting revert back to a smaller size after having enlarged them before composing an email. Also asked on google forum. Firefox 3.6",1268457007,\N
614669,"1","Add-ons: ",1268457059,\N
614671,"1","When I open a link in a new tab it used to put the tab in the last position but now it inserts it in the middle - can I change that behavior?",1268457233,1268467169
614674,"1","How do I get the page content to fit the page so that I don't have to use the side scroll?",1268457674,\N
614676,"1","How do I stop my browser from blocking popups in my Comcast mail system?",1268457752,\N
614678,"1","before firefox wasnt opening secondary videos in Youtube, after latest version opens them as a page of code.",1268457904,1268534161
614680,"1","NEW THREAD Encoding issue. The following HTML code auto puts itself in when I type .",1268458117,1268458284
614683,"1","\"Send Link/Image\" options not working as expected with Windows Live Mail",1268458345,\N
614687,"1","why I can't open the firefox web browser after I installed the firefox 3.6( Window XP)",1268458487,\N
614689,"1","I want to block wikipedia sites.  How do Ido this?",1268458595,\N
614691,"1","forum problme",1268458833,\N
614692,"1","The instructions tell you what to do. But they do not tell you where to find the tabs! Where is the location folder? The profile tab, allow web sites, and I cant find anything!",1268458957,1268536542
614694,"1","Can i make the new tab to open at the end of the line of opened tabs like previews version of firefox.",1268459241,1268503824
614696,"1","Tabs are opening beside the tab the link was in rather than at the end of the tabs like it previously did.  How can I go back to the old way of opening tabs so they open in order rather than this new method?",1268459409,1268466687
614698,"1","Trying to open FF....Entry point not found \"The procedure entry point js_NextActiveContext could not be located in the dynamic link library js3250.dll",1268459900,\N
614699,"1","Any menubar or toolbar not showing  only tab bar is appearing & in safe mode these are showing",1268459915,1268536789
614702,"1","The page is too wide for my screen.  i have to reposition it to the left in order to see the scroll bar on the right side, and then reposition the page to the right to see my email.  help!",1268460164,\N
614704,"1","menu reference bar is missing how get it back?",1268460347,1268537081
614705,"1","how do I get the colors back for the dropdown, minimize, close folder",1268460602,\N
614708,"1","Does FF have a quick launch version?  It take so long to load at start up.  Is Chrome a better alternative?",1268460683,\N
614710,"1","Very low volume with streaming videos.",1268460784,\N
614715,"1","FF crashed suddenly, on booting again all saved tabs lost",1268461205,\N
614720,"1","Need help installing new Java",1268461604,1268488895
614726,"1","Firefox pop up in yahoo pool",1268462354,\N
614729,"1","Mousewheel stops working in 3.6",1268462982,1268678558
614733,"1","Deleting cookies",1268463110,\N
614737,"1","I get an upload failed message when trying to upolad files to certain sites, like blogtalk radio.",1268463229,\N
614746,"1","Emails not marked as read, even after marking them manually",1268463599,\N
614748,"1","IM pop-up panels merge into web page (no border) - MySpace",1268463690,\N
614760,"1","how do i get rid of a black line between my bookmarks and toolbar?",1268464307,1268487116
614770,"1","after installing the latest version of firefox 3.6 it is not longer possible to previeuw html pages in the firefox brouwser! How to manage this problem?",1268465092,1268466056
614773,"1","SSL Error 61 - tells me I have chosen not to trust a servers security certificate, but I haven't don eanything I think",1268465887,1268754981
614774,"1","Firefox will not allow media streams to play.  It shows a black scree with the message \"Waiting for Video\".  Never happened with previous version.  Doesn't hapen in IE.",1268465933,\N
614776,"1","I have no address box or menus or anything at the top of my browser",1268466266,1268466589
614785,"1","How to change My Profile when Firefox won't load?",1268466843,1268541980
614787,"1","Can see options on you tube but can't watch videos help?",1268466901,1268552958
614788,"1","since the recent update, my email signature is no longer on my emails and when i hit reply i do not see the email that I am replying to and before the update I could.",1268466962,\N
614790,"1","my window is too large, I cannot see my scroll bar onside",1268466968,1268467747
614793,"1","Can you direct me to the default \"Applications-Actions\" in FireFox Tools/options?  I just need to find the original settings for actions of applications.  I changed them and wish to put them back as they were.   By the way, if I want to listen to broadcas",1268467313,1268542084
614794,"1","have lost the ability to open firefox from my keyboard internet button and from Ctrl+Alt+Z",1268467524,1268543071
614798,"1","How can I remove the line \"keyword.url\" under Name and http://search.bearshare.com//web?src=fb&q=\" under Value in the Modified Preferences box in the Troubleshooting Information section?",1268467913,1268541306
614800,"1","hey all, I am using the latest version of Firefox 3.6 and I have a quick question regarding the awesome bar. I want to make more room on my toolbar space, so I wanted to get rid of my searchbar- however, I need to be able to search quickly without loading",1268468014,1268620992
614801,"1","I just updated to 3.6 and i got *xg.dll 1.3 addon installed.",1268468094,1268477751
614802,"1","My iMac is limited to run Panther (OS 10.3.9), and your link to Firefox 2 is broken.",1268468247,1268477590
614805,"1","how to rearrange bookmarks",1268468634,1268560724
614809,"1","How can I unistal and remove Firefox from my machine (XP pro SP3)",1268469214,1268469843
614812,"1","Firefox remembers zoom-level of pages - how to disable it?",1268469385,1268487201
614813,"1","I had the Black Stripe after updating to 3.6, which I cleared by disabling the ZoneAlarm Spy blocker Stub Plugin. In its place ther e is no a horizontal slide bar with a lego, ie pugin icon above it",1268469537,\N
614814,"1","how to get out the facebook.com/login from being untrusted",1268469540,1268616524
614819,"1","When I opened firefox today, all my bookmarks were gone, and I can't bring them back or add new ones - I just have an empty toolbar. I've tried multiple online suggestions on what to do, but nothing's worked. I haven't done anything different such as inst",1268469856,1268488510
614827,"1","Is there a way to send all of my firefox add-ons and settings to another computer?",1268471051,1268471318
614830,"1","Session Data Lost Due To Upgrade",1268471208,1268472032
614832,"1","Have To Reformat; Don't Want To Lose Bookmarks, Extensions, Settings, and Tabs.",1268471351,1268538774
614833,"1","Between the address line and the tabs line is in v6.0 a black line, how do I get rid of that?",1268471360,1268487133
614837,"1","Youtube still says that my version of Firefox is not supported however, I have it upgraded.",1268471738,1268476644
614838,"4","Latest firefox doesnt work on Mac osx Snowleopard",1268471813,1268500346
614840,"1","FX 3.6 Add-ons & extensions are there. Extensions are working but not visable",1268472293,\N
614842,"1","How do I stop Firefox from auto updating",1268472403,1268501110
614843,"1","How do I get the sothink web downloader to work correctly ?",1268472613,\N
614846,"1","I want to have \"Find in this page\" not as bar, but as dialog; the extension works almost always, but sometimes it throws out the exception about bad pointer",1268472974,\N
614847,"1","Want to open new tabs as igoogle home page not blank then have to hit google bookmark",1268472977,1268474285
614849,"1","Saved passwords always lost when updating",1268473014,1268490597
614854,"1","After update to 3.6 FF wont load, nor in Safe Mode",1268473308,1268635432
614858,"1","Statusbar became higher than the original one.",1268473498,1268526454
