619126,"1","How do I make new tabs open to the far right, rather than right next to my current tab?",1268758753,1268763509
619128,"1","In Firefox 3.6 my username IDs for websites autofills but for some reason the password no longer autofills.  How does one fix this?",1268758846,\N
619129,"1","Firefox often is running when it shows no indication of running to me;  But when you try to go to a new site, it says you must close Firefox first, but there is no way to get to this invisible Firefox running program except to reboot the computer co",1268758897,1268778857
619130,"1","hotmail, \"reply\" button gives white screen",1268758966,\N
619136,"1","la barre d'outils a disparue.Comment la remettre",1268759237,1268779112
619138,"1","right-click to \"open in a new window\" function is not working",1268759398,\N
619139,"1","Microsoft Office Communicator (Web Access) conversation and tools windows do not work in Firefox 3.6, but do in Safari 4",1268759425,\N
619140,"1","I recently changed my password, now on startup I get a warning that my pasword and username don't match fir my gmail account",1268759446,\N
619141,"1","How can I set up an \"Out of office response.\" in Firefox?",1268759506,\N
619142,"1","I have a problem accessing a site that I've used regularly in the past.",1268759564,1268760641
619145,"1","Java plug in not working with Firefox 3.6?  I plugged in Keep Tube and Cool Previews are either of these the problem or is it Firefox 3.6?",1268759602,1268779383
619146,"1","FF has stopped prompting for 'save password'",1268759603,1268779433
619147,"1","How do I disable Private Browsing?",1268759741,\N
619149,"1","How Do I Stop Search From Address Bar From Opening A Website Other Than Google Search Results?",1268759755,1268779502
619150,"1","After upgrading to Firefox 3.6, when I click on HTML files on a CD of a website we are building, it won't open in Firefox.  However, the HTML files open in Netscape and Safari.  I hate to drop Firefox as my browser, so I hope I can get this resolved.",1268759802,\N
619152,"1","I have downloaded Mozilla Firefox 6 once again thinking that this would solve my unexpected problem with not being able to access my Mozilla homepage....not so!  I still can't sign into my homepage and cannot find a place to do so....please help.",1268759889,\N
619154,"1","stock charts do not work",1268759920,\N
619156,"1","I get a DNS message when I try to access www.usmc.mil/, a site usually open to the public.",1268759964,\N
619157,"1","How do I change the design (background picture) on firefox?",1268760025,1268768368
619158,"1","My firefox window is only showing up in 3/4 of my computer screen. It's not minimized.",1268760093,\N
619159,"1","How can I view a PDF in FireFox on a Windows machine?",1268760113,1268819481
619162,"1","I have a Mac and the instructions on how to empty the cache do not work on the Mac version of firefox.",1268760162,1268780196
619163,"1","Cannot Remove Most Visited - Getting Started - Latest Headlines bar",1268760230,1268766339
619167,"1","When I access the Comcast email and web links from Comcast email, the up/down arrows on the vertical scroll bar do not work.",1268760415,1268846800
619168,"1","FireFox opens 2 Blank Emails, when I submit information",1268760555,1268766970
619169,"1","Webpage no longer automatically displays new content - why? Can I fix it?",1268760581,\N
619170,"1","Why won't Firefox 3.6 show java pop ups, about window, download window or add-ons window?",1268760604,1268808184
619171,"1","How can I make my form and search history alphabetized again after the last update scrambled them?",1268760633,1268765564
619175,"1","Newest update of Firefox downloaded and installed itself. Now Java will not work on game sites. It still works in Explorer. How do I (or Firefox) fix this?",1268760850,1268775322
619176,"1","accessing tneb.uscourts.gov",1268760906,\N
619180,"1","Newly added add ons only last for a session such as Clean&Click,Phzilla.",1268761163,\N
619183,"1","'firefox.exe - Entry Point Not Found' this pops up any way I try to start Mozilla.",1268761241,1268780144
619186,"1","Can I have two different versions of Firefox on my computer running at the same time",1268761407,1268773579
619191,"1","Why can't I load pictures onto ebay?",1268761706,\N
619195,"1","firefox is infected with trojan-bnk.win32.keylogger.gen. what can i do to delete it ?",1268761838,1268762166
619197,"1","page goes blank when connecting with broadband card",1268761894,\N
619199,"1","i get the error message application failed to start unable to find the file xpcom_core.dll",1268761969,\N
619200,"1","how can I remove my norton and yahoo tool bars.",1268761989,1268768231
619201,"1","I want my last version back",1268762063,\N
619202,"1","How do I hide specific bookmark folders from other users?",1268762089,\N
619205,"1","How do I restore all previous tabs lost when Foxfire updated?",1268762186,\N
619206,"1","I have created a web page in Dreamweaver and the background colors do not show up in Firefox.",1268762208,\N
619210,"1","Why can't I pull up my Yahoo calendar?",1268762312,\N
619212,"3","Minutes of SUMO meeting 2010-03-15",1268762494,\N
619215,"1","Why did my saved passwords not import to updated version of foxfire?",1268762592,\N
619218,"1","How do I access my caldender and notepad?",1268762678,\N
619219,"1","while leaving hotmail I have a security warning regarding unencryption always",1268762731,\N
619224,"1","How do I change the temporary file and cookie location?",1268763051,\N
619225,"1","The new version of firefox 3.6 for macs causes my system to crash when I try to print on HP 3100",1268763053,\N
619230,"1","How do I permenently delete a toolbar",1268763258,\N
619231,"1","How do I reset the themes? I installed one but now prefer not to use that feature. Please provide buttons/options to manage themes in a way the user can follow intuitively. I wasted hours looking for a \"switch back to original\" and did not found out how. ",1268763350,1268763997
619233,"1","Firefox will not maintain my selected home page even though I have tried both suggestions for setting it.  When I leave Firefox and come back to it, it returns to Firefox start page.",1268763371,\N
619237,"1","NEW instructions for Installing/Updating Adobe Flash",1268763505,\N
619240,"1","I have to restart Fire Fox 1-2 3 sometimes 4 times to be able to right click within the browser...Why..?",1268763673,1268764579
619241,"1","It seems that my mouse wheel no longer scrolls after installing Firefox 3.6; it scrolls in other Microsoft applications, e.g., word, excel, etc., as well as Internet Explorer",1268763741,\N
619242,"1","I cannot install Firefox 3.6 in my Red Hat Linux desktop.",1268763825,\N
619244,"1","How do I change the language settings on my bookmarks settings?",1268763926,\N
619245,"1","How do I edit my contact (addresses) list?",1268763935,1268774754
619248,"1","I clicked to reset the Software Security Device Master Password, but I was not told where to find the new password.",1268764030,1268774204
619253,"1","When I try to download firefox get a suspicious file to download",1268764214,1268768930
619255,"1","Firefox slows my computer drastically, but Safari does not.  This has just started in the past couple of months.",1268764251,\N
619259,"1","why does firefox not open and tell me there is another instance running when there is no other instance running",1268764455,1268765130
619260,"1","3.6 update no longer opens my downloaded saved pages in new window.",1268764491,\N
619261,"1","Firefox will not appear on my screen when i double-click on the desktop icon; why do I have to run \"\"C:\\Program Files\\Mozilla Firefox\\firefox.exe\" -ProfileManager\" in order to run Firefox?",1268764518,\N
619264,"1","Accessibilty - how does one select a radio button without using a mouse?",1268764606,1268764973
619266,"1","Why are rtf files opening as if they are one run-on sentence while in IE they open fine?",1268764691,\N
619268,"1","in hotmail when sending a message forword the message some time is sent blank (empty) this problem occur when I upgrade to the new virsion of firefox",1268764763,\N
619271,"1","On older veersions there was the option to open a page in IE, but I no longer have it, and cannot find it in any of the plugins, how do I get that back?",1268764820,1268765901
619273,"1","When I login Yahoo Mail, I can not write a new mail or reply/ forward any mail.",1268764833,\N
619274,"1","Twice in two days!",1268764917,\N
619275,"1","can i adjust print margins?",1268764958,\N
619278,"1","How do i reset homepage?",1268765057,1268765388
619279,"1","When I use a drop-down menu in an Oracle Page the menu is greyed out and unusable. the error-consol says -->Warning: Error in parsing value for 'z-index'.  Declaration dropped.",1268765086,\N
619282,"1","can't send email (\"takes too long\") or recipient says they're blank",1268765241,1268767028
619284,"1","yahoo mail wont load  says done only a blank page",1268765409,\N
619285,"1","Whats a ***!!!!!!!! Why in 3.6 version for linux i have mozilla.org as home page and can't change it????? I",1268765526,\N
619289,"1","a bx floats around on the screen showing input not supported",1268765757,\N
619290,"1","Tabs no longer open with the newest one to the right. I want to open in a certain order, and stay that way. And any new SHOULD go to the right, not stuck in the middle and pushing other tabs.",1268765767,1268854561
619294,"1","I am no longer able to print coupons from certain websites.  I am prompted to install a coupon installer (which has been installed) and the coupons are not printed.",1268765902,\N
619298,"1","why does firefox.exe rmain open after I close the browser window, consuming system resources?",1268766218,1268766715
619299,"1","How can I permanently set the zoom level so that I don't have to change it every time I open the browser.",1268766238,1268766683
619302,"1","what happened to the IE switch?  I cannot use certain programs in firefox",1268766311,1268766603
619304,"1","Firefox upgrade from 3.5.7 to 3.5.8 and also to 3.6 no longer connects to the net unless i exit PeerGuardian 2. I use Windows XP and an Anthlon processor. How do I fix this so that I can use PG2 and Firefox?",1268766387,1268768266
619305,"1","Since switching t Firefox, my google adsense ads will not load on my site on my computer (google error 404) - \"The requested URL was not found on this server\".  Any suggestions?.",1268766407,\N
619307,"1","Where do I find the passwords Firefox has saved?",1268766538,1268767136
619312,"1","New user, used to use F11 to expand screen, lose menus & start bar. F11 does not do this on Firefox?",1268766640,\N
619317,"1","I delete old bookmarks, the star is no longer blue, but the bookmarks are still there?",1268766725,\N
619320,"1","IN my hotmail account when I press reply button for a message that i want to reply the original message does not appear in the pane but when i do the same with internet Explorer browser no problem.",1268766752,\N
619321,"1","ApDiv features are not showing on FF3.6 - fine on previous versions and IE - help!",1268766759,1268767633
619325,"1","Applications keeps reverting to Adobe Accroabt",1268766839,1268771799
619329,"1","Upgraded to Firefox 3.6 and now it won't start",1268767008,1268840815
619331,"1","Snapit scrolling capture no longer works in 3.6 is there a fix yet?",1268767121,1268767355
619333,"1","I tried to download firefox..It asks to choose a program to open with, so i chose IE, but it wont left me complete the download",1268767156,\N
619334,"1","Firefox is constantly HANGING when I visit Facebook and MySpace, I don't have a proxy selected, how do I fix this?",1268767216,\N
619335,"1","How do I remove the pencil icon for \"write an entry about this page\"",1268767242,\N
619336,"1","How do I move my bookmarks from a dead computer to my new computer.  I have a 2.5\" hard drive enclosure and can find the files but cannot locate where on the hard drive my bookmarks are.  I need detailed instructions.  I have moved all my other files with",1268767276,1268768355
619338,"1","Embedded background music plays intermittently while YUI Animations run",1268767309,1268769314
619342,"1","each Web site asks for several cookies repeatedly",1268767536,\N
619346,"1","while downloading Firefox it tries to upgrade and then gets stuck",1268767744,\N
619347,"1","A message appears at start up regarding Firefox's need for a font. How can I stop this?",1268767755,\N
619348,"1","I have Win XP Home and a box with verification words keeps coming up saying shut down in 3 minutes",1268767763,1268768880
619349,"1","Java Plugin 6u18 does not appear in Firefox 3.6 Solaris 10 SPARC",1268767765,\N
619352,"1","My web browsing tab is gone, how do I get it back",1268767835,\N
619355,"1","I have disabled my menu bar .. and now can't re-enable menus with no menu bar to get there ?? HELP",1268767858,1268768021
619356,"1","Firefox does not execute javascript commands, but Javascript is turned on",1268767889,\N
619358,"1","Web sites and my email just stops. When i reboot, it say, \"Well, this is embarssing.",1268767980,\N
619367,"1","a communication error occured. \"Connection refused\"",1268768374,\N
619369,"1","I get \"File is Corrupt\" error when trying to install Firefox",1268768415,\N
619371,"1","How do I get \"Roboform\" to display in the upper toolbar area like with I.E. 7?",1268768614,1268769610
619372,"1","how to make firefox download binary file with download manger",1268768648,\N
619375,"1","Downloaded 3.6 by accident. How do I prevent its install when I next start Firefox?",1268768767,1268780193
619378,"1","how do I block access to specific web pages?",1268768909,\N
619380,"1","Just today firefox won't upload replies on facebook and is causing gmail not to load in the standard format, why?",1268768955,\N
619381,"1","my pop ups are not blocked and I cannot to open it",1268768990,\N
619382,"1","you tube wont play videos with fire fox",1268769146,1268769463
619383,"1","I just downloaded Firefox on my XP laptop but all the sites I go to are blank",1268769172,\N
619386,"1","How do I stop being redirected instead of going directly to the link I want?",1268769278,1268792413
619395,"1","with latest version pages or sites are MUCH MUCH slower to load. how can i revert to the previous version?",1268769550,\N
619399,"1","How do I adjust the number of lines it scrolls when I press the \"down\" or \"up\" key?",1268769637,\N
619400,"1","It appears that every WordPress site I have visited (since the last FireFox upgrade} shows open boxes in place of text characters. I have viewed the same site in Safari with sucess. What is causing this?",1268769638,\N
619401,"1","It says I can't upgrade to 3.6 w/o closing Firefox first, which I have already done.",1268769730,1268770979
619402,"1","printing not win 32 compatible",1268769739,\N
619403,"1","bookmarks disappear when I reboot XP",1268769749,\N
619404,"1","When I try to import bookmarks from opera, nothing shows up?",1268769792,1268770029
619405,"1","onlne mail system will not allow attached files",1268769807,\N
619408,"1","I accidentally deleted my bookmark button at the top by \"file\" \"edit\" \"History\" \"tools\" \"help\"   - how do I get it back",1268770013,1268826680
619412,"1","I upgraded to 3.6 and tried one of new themes.  Didn't like.  When look at bookmarks the type is super small and can't figure out how to increase the font size of these dropdown menues.  Thanks",1268770068,\N
619413,"1","Extremely slow opening of new window",1268770102,1268864889
619414,"1","i would like to reload the previous version, the new version has dis abled mousewheel scrolling in a very important program i use everday (freestockcharts.com)",1268770133,1268781333
619415,"1","I can't get Firefox to Step 2 (launch with Wizard).  I think my computer has a virus.",1268770153,\N
619416,"1","How do I enable the awsomebar? I disabled it along with another part of firefox and my browswer only shows my favorites and current tabs.",1268770252,1268770368
619417,"1","After upgrade 3.5 to 3.6 mouse wheel scroll doesn't work",1268770316,\N
619418,"1","how do iget rid of bearshare in my navigation or search bar",1268770357,\N
619423,"1","HTML not updating?",1268770796,1268781215
619427,"1","Firefox Hang problem solved",1268771112,\N
619428,"1","How do I stop Firefox from launching on Windows XP start up?",1268771135,\N
619429,"1","I added weather, etc., dragged the url to the home icon to make it my home page, but when I reopen Firefox, it goes back to the original page.",1268771168,\N
619430,"1","kjbbvr",1268771248,1268771383
619435,"1","running incredibly slow after automatic security update",1268771645,\N
619439,"1","2 problems - 1 is that firefox keeps crashing ALL THE TIME, 2 the screen of the game that I play is cut off all aroung.  When the game is open in IE the playing board is perfect and not cut off around the edges.",1268771737,\N
619440,"1","Firefox won't start. Message comes up, Warning: Unresponsive Script........",1268771761,\N
619443,"1","The Find bar for finding text on a page has changed behavior and it is frustating to use",1268771849,1268854100
619445,"1","after new update my tabs open in the wrong direction.",1268771890,1268772029
619446,"1","www.google.com",1268771947,1268772509
619448,"1","I have made a mistake and removed all the toolbars to get more screen for viewing on my laptop but I can't get those toolbars back please help",1268772060,1268774427
619449,"1","When I click on a link in an e-mail, Firefox opens two windows; my homepage and another window with the link contents. Never done that before.",1268772093,1268873089
619452,"1","Firefox is not loading web pages",1268772164,1268798522
619454,"1","Your information: \"Note: The Do this automatically for files like this from now on setting may be disabled when downloading files from certain websites. This can happen if the website's server incorrectly specifies the content type of the file. It also ca",1268772218,\N
619461,"1","Has anyone got a link to an about:config tutorial that's not BC. (before Commodore)?",1268772511,1268780806
619462,"1","Bookmarks drop down menu too small after 3.6 upgrade",1268772540,1268860079
619464,"1","since yesterday Firefox crashes frequently when i try to print address labels and invoices from eBay.com",1268772711,\N
619466,"1","will not play Brasschecktv videos",1268772852,1268803398
619469,"1","Will not display pictures on vistaprint.com website",1268773110,\N
619472,"1","CPU Usage at 100% when doing HTTP POST upload",1268773314,\N
619473,"1","need autofill, have 3.6 firefox, goggle chrome, internet explorer, directions available r not good",1268773383,\N
619475,"1","Firefox crashes when I print from a web page.",1268773521,\N
619476,"1","After update to Firefox 3.6, new tabs no longer open automatically in the foreground. My \"tab\" preferences are set correctly. How do I get the functionality back?",1268773566,1268847135
619482,"1","Firefox 3.6 does has very delayed opening of new windows on Mac 10.5.8",1268773924,1268876425
619486,"1","How do I change the screen aspect ratio ?",1268773985,1268775300
619488,"1","Since downloading latest version of Firefox, I get an error message when I try to watch a video on You Tube.",1268774227,1268780709
619489,"1","how do i disable/suppress the right click menu from javascript in FF 3.6",1268774263,1268779564
619496,"1","Firefox does not load checkout page on game.co.uk",1268774507,\N
619497,"1","When I open one bookmark in a bookmark file, all the bookmarks in that file open.",1268774635,\N
619498,"1","Non-responsive to tab selection and closing tabs",1268774664,\N
619500,"1","All my impoted bookmarks go to the same webpage",1268774795,1268896257
619503,"1","will not play videos on you tube but used to.",1268774956,1268775346
619504,"1","with upgrade to 3.6, I lost ability to 'view in browser' in eudora. Firefox opens but not to a page view. What do I do to remedy?",1268775090,1268914186
619510,"1","can firefox help me connect to my son to play command and conquer",1268775337,\N
619512,"1","There was a problem with the Windows Live Hotmail service (a temporary network connectivity issue that has nothing to do with your computer when trying to delete messages",1268775424,1268782751
619513,"1","I just installed an upgrade from Firefox and now my email signature won't save.  It works fine still in Safari.  I'm using an iMac G5 - 10.6.3  Please help!",1268775457,\N
619516,"1","When I check my email, the sign-in part in encrypted, but then the email part says \"you are on an unencrypted page\", is that safe and how can I fix it?",1268775524,1268777723
619518,"1","I need to remove a toolbar called mywebsearch on a mac.",1268775610,1268777859
619521,"1","i don't want cookies",1268775667,1268776596
619522,"1","After installing 3.6, web pages no longer fill up the screen, but leaves a black bar above the page.",1268775711,1268776418
619526,"1","installed new firefox 6.3....then firefox would no longer work on my new Samsung netbook with windows 7...get error message \"XUL  error platform  version 1.9 1.8  is not compatible  min Version >=1.9.2  max Version",1268775904,1268791329
619527,"1","inbox has attached itself to firefox how do i get rid",1268775920,\N
619528,"1","How can I return to a previous version of Firefox?  I upgraded to 5.0 and my online banking does not support this version.",1268775953,1268778515
619529,"1","I can't print coupons from www.redplum.com after upgrading to Firefox 3.6",1268775956,1268793826
619530,"1","Firefox will not display the fonts on a website but IE will.",1268775956,1268896325
619532,"1","I can't upload or delete files, pics, stories on facebook using firefox. Internet explorer works fine. I have cookies enabled.",1268776197,\N
619533,"1","I hae the mac gos software on my laptop, I can't get the upgrade to start.",1268776274,\N
619544,"1","computer crashed and o.s. restored. Firefox runs, but bookmarks missing. Looked at various instructions for restoration, but don't know where to get \"backup\" file. Tried installing an HTML, but it did nothying.",1268776675,\N
619545,"1","Hidden windows?",1268776734,\N
619550,"1","using Inkfrog to create ads for ebay; under old version of Firefox no problems; new version does not allow the preview button to work; have disabled all pop up blockers, but preview still does not work",1268776992,\N
619553,"1","The games site pogo.com is no longer usable on my computer since my recent firefox update please fix it!",1268777251,1268777843
619555,"1","its not letting me go on wahackpokemon.com",1268777357,1268899817
619559,"1","tjmccr: Lost bookmarks after upgrade.  No entries in Extensions under Add ons",1268777507,1268777674
619560,"1","Can't bookmark a page and also all my bookmarks are lost. Restore backup results in error messgae.",1268777577,\N
619570,"1","Scrolling with wheel mouse won't work in Yahoo Mail Inbox. OK everywhere else.",1268778178,\N
619571,"1","why won't the latest firefox work with Robo Form",1268778190,\N
619574,"1","I installed new version of Firefox. Have seemed to lost all Sxipper settings. How do I get them back?",1268778320,\N
619575,"1","I do not have file, bookmarks, edit after installing 3.6",1268778324,1268778561
619581,"1","can't attach pictures to my emails -- only with Mozilla",1268778571,\N
619582,"1","How can I expand the quick links favorites icons menu bar?  It only holds 61 Icons before it send any extra icons to an expanded view option.  I'd rather have 2 bars of 61 icons!",1268778576,\N
619592,"1","Tonight, for the first time, I have a basic toolbar- no bookmarks, no view, no tools, etc",1268778961,1268779640
619597,"1","Your help IS WRONG. with regard to cookies.  I need to address cookies",1268779171,1268780109
619598,"1","move to in gmail under firedox 3.6 fails",1268779178,\N
619599,"1","What is required to get 3D to work in Bing Maps?",1268779187,1268904746
619600,"1","The \"Preview in firefox\" option in Dreamweaver is not displaying web page",1268779191,1268900488
619601,"1","How do I move bookmarks from one Windows XP computer to a new WIndows 7 , both with Firefox.",1268779200,1268904209
619603,"1","How do I get to the \"Allowed Sites - Software Installation\" window??",1268779327,1268779767
619606,"1","i am running in safe mode how to restore original settings",1268779385,1268904313
619607,"1","cannot down load images w latest update",1268779385,1268905317
619609,"1","Firefox is blocking downloads as well as adding themes, followed help menu and it didn't correct.  Started when I downloaded new version of Firefox today.",1268779470,1268905850
619613,"1","cannot load verizon wifi installer 1.0.  Incompatible",1268779697,1268868761
619614,"1","Firefox slows badly after being open for a few hours. Closing and restarting it will return the original speed but it's a pain.",1268779742,\N
619617,"1","Why will v.3.6 not play Windows Media Stream content like it did in previous versions? I get a prompt to download Flip4Mac, but then have to download it manually, then it will not install. Then I have to  open Windows Media Player in order to hear the str",1268779826,\N
619618,"1","firefox won't load all pages on secure bank site",1268780065,1268883463
619625,"1","Firefox 3.6 is displaying websites incorrectly",1268780229,1268869618
619626,"1","everytime I open my yahoo email there is a message stating blocked images and do I want to show them.  I just started to have this problem.  In the past the images were just shown in the email.",1268780249,\N
619628,"1","How do i transfer cookie information from an active IE session to a new FireFox [FF invoked from IE] session?",1268780617,\N
619631,"1","Tools>Add-ons not displaying any installed Add-ons.",1268780736,\N
619633,"1","How to Prevent Grouping of Tabs",1268780842,1268783448
619634,"1","Php sites have suddenly stopped working for me",1268781018,\N
